Video Id,Video Title,Channel Id,Channel Title,Video Tags,Channel Country
qJ12rTFAH0o,Pinoy Gamers React to Jumpscares in Different Horror Games (PART 4),UCXX5ZeFTpjyNPdTdT8sqDlQ,Pinoy Gamers React,"['pinoy react horror games', 'kristian ph horror games', 'sansendesu horror games', 'asheru gaming horror games', 'celimush horror games', 'paolul horror games', 'james robin q guirre horror games', 'evo kaloko', 'funny reaction', 'nakakatakot na laro', 'sobrang nakakatakot', 'funny pinoy reaction', 'different horror games', 'youtuber pinoy horror compilation', 'pinoy youtuber plays horror games', 'pinoy jumpscare', 'funny pinoy jumpscare', 'reaction gaming videos', 'funny pinoy games', 'pinoy plays horror games']",PH
ZMeocN_JNuw,Pinoy Gamers React to Jumpscares in Different Horror Games (PART 1),UCXX5ZeFTpjyNPdTdT8sqDlQ,Pinoy Gamers React,"['pinoy react horror games', 'kristian ph horror games', 'sansendesu horror games', 'asheru gaming horror games', 'celimush horror games', 'paolul horror games', 'james robin q guirre horror games', 'evo kaloko', 'horror reaction', 'funny reaction', 'nakakatakot na laro', 'sobrang nakakatakot', 'funny pinoy reaction', 'different horror games', 'youtuber pinoy horror compilation', 'pinoy youtuber plays horror games', 'pinoy jumpscare', 'funny pinoy jumpscare', 'reaction gaming videos', 'funny pinoy games']",PH
pyI_yNTJzrk,Foreigner Reaction To Filipino Street Food 🇵🇭,UCXXlfcu-12obaE62wSEgazw,NotJeffandSonia ,"['philippines', 'gingoog city', 'food reaction video', 'trying new food', 'foreigner trying filipino street food', 'philippines street food', 'foreigner react to filipino street food', 'foreigner reaction to pinoy food', 'foreigners react filipino food', 'foreigner reaction to filipino foods']",US
IxGdNHDMFPI,Trying Philippines Street Food,UCXXlfcu-12obaE62wSEgazw,NotJeffandSonia ,"['Trying Philippines Street Food', 'philippines', 'filipino food', 'street food', 'philippines street food', 'filipino street food', 'street food philippines']",US
ePXHjODu1vE,SB19 Asia Artist Awards 2023 (AAA) FULL PERFORMANCE REACTION (ft. &TEAM),UCXaDslGhnb1GE-YAp1VWG7A,paigepop,['#kpop'],US
LBpqgokZ1yQ,A young  man with a very good sense of humour. #goodvibes #stressreliever,UCXaru5ChPJ5uTPEXNAHeiYw,Mother Road,"['interesting man', 'intelligent boy', 'funny', 'good vibes', 'positive energy', 'relaxing', 'relieved stress']",GB
NM7eY-IHCvU,FIRST TIME SA BORACAY. #boracay2023 #boracayislandphilippines #travel #philippines #vitaminsea,UCXdsfDQP8r67wMgWnL_nzBw,Jessieee_,[],Unknown
5d7EYahP4Bg,That's What Friends Are For - Limuel Llanes and Friends (Philippine Karaoke) REACTION!!!,UCXisjO3r0KC_Vh-PWwPTbBA,MontWRLD,"['#Trend', '#Trending', '#Viral', '#New', '#Youtuber', '#React', '#Reactions', '#Funny', '#Comedy', '#Reaction', '#memes', '#meme', '#tiktok', '#instgram', '#twitter', '#facebook', '#youtube', '#korean', '#rusia', '#usa', '#kpop', '#philipines', '#sb19', '#karaoke', '#philippines', '#ppop']",US
ywHn0gQQGgg,😂TWO KITCHENS😂 The Cost of Living in the Philippines - What Can You Buy With $1 (Reaction),UCXisjO3r0KC_Vh-PWwPTbBA,MontWRLD,"['#Trend', '#Trending', '#Viral', '#New', '#Youtuber', '#React', '#Reactions', '#Funny', '#Comedy', '#Reaction', '#memes', '#meme', '#tiktok', '#instgram', '#twitter', '#facebook', '#youtube', '#korean', '#rusia', '#usa', '#kpop', '#philipines', '#vlog', '#costofliving', '#philippines', '#filipinos', '#pinoy']",US
FLsTtX7FMJA,🎤 Filipino 'LISTEN' Mic sharing CHALLENGE! 400k Likes in 24hrs!🔥 (Reaction),UCXisjO3r0KC_Vh-PWwPTbBA,MontWRLD,"['#Trend', '#Trending', '#Viral', '#New', '#Youtuber', '#React', '#Reactions', '#Funny', '#Comedy', '#Reaction', '#memes', '#meme', '#tiktok', '#instgram', '#twitter', '#facebook', '#youtube', '#korean', '#rusia', '#usa', '#kpop', '#philipines', '#us', '#america', '#kick', '#streamer']",US
91YtKieEb88,His First Time Listening To FLOW G - RAPSTAR (Official Music Video),UCXisjO3r0KC_Vh-PWwPTbBA,MontWRLD,"['#Trend', '#Trending', '#Viral', '#New', '#Youtuber', '#React', '#Reactions', '#Funny', '#Comedy', '#Reaction', '#memes', '#meme', '#tiktok', '#instgram', '#twitter', '#facebook', '#youtube', '#korean', '#rusia', '#usa', '#kpop', '#philipines', '#rapstar', '#flowg']",US
1eY2fezh5Go,TRYING Filipino FOOD,UCXnjCKqBovLz3n5Bon6Ktmw,The Black Vato,[],US
bGqzqDyWyMY,Canadian American Foreigner speaking tagalog: Nawawalang Pinoy,UCXpg7S5gBHT_pevH1wdCt4Q,Nawawalang Pinoy,"['filipino', 'speak', 'tagalog', 'philippines', 'pinoy', 'canadian', 'american', 'foreigner', 'speaking tagalog', 'white', 'canadian speaking tagalog', 'canadian speaks tagalog', 'american speaking tagalog', 'westerner speaking tagalog', 'american speaking filipino language', 'american speaking filipino', 'american try to speak tagalog', 'lost filipino boy', 'lost filipino', 'filipino abroad', 'white filipino', 'filipino in canada', 'filipino in the usa', 'foreigner speaking tagalog', 'funny speaking tagalog', 'foreigner philippines']",Unknown
L6FshOdrsZg,"MobaZane: ""Flight tomorrow!"" | React to dogie & Gemik | PH Bootcamp | 1v1 with Wise?",UCXscyPOmKPotwcfqYGyqxiQ,ZEkilled,"['mobazane to ph', 'mobazane to philippines', 'mobazane trip to ph', 'mobazane livestream', 'mobazane videos', 'mobazane highlights', 'mobazane clips', 'mobazane reacts to dogie and gemik', 'mobazane joins gemik', 'mobazane gameplay']",PH
eyk-8zBw5K4,First Time Trying Max's Filipino Restaurant!,UCXuyB2hyb2rw9-Arn8fBAgw,KingSchratz,"['mukbang', 'cooking', 'eating challenge']",US
psHUwrdwDCg,First Time Trying Filipino Food Ever!,UCXuyB2hyb2rw9-Arn8fBAgw,KingSchratz,"['mukbang', 'cooking', 'eating challenge']",US
1pTriRO-_U8,Trying Filipino Spaghetti and Fried Chicken...SO GOOD...(Mama Fina's Hackensack NJ),UCXuyB2hyb2rw9-Arn8fBAgw,KingSchratz,"['mukbang', 'cooking', 'eating challenge']",US
P2BQV3b6RhE,$100 Filipino Street Food Challenge in Manila!! Is It Possible?,UCXw1ddyrUmib3zmCmvSI1ow,More Best Ever Food Review Show,"['besteverfoodreviewshow', 'befrs', 'streetfood', 'foodreview', 'foodblogger', 'foodandtravel', 'yummy', 'foodie', 'nomnom', 'travel', 'sonnyside', 'sonny', 'foodgasm', 'foodporn', 'foodandwine', 'seafood', 'food', 'delicious', 'travelchannel']",US
-ayXvH4x-NA,[ All Kiss Scene BL ] BoyBand Love The Series | Filipino BL | Intimate Scenes,UCXxiRtpxKFiq1AfkE9UTI2g,ppoppo hae,"['BoyBandLove The Series', 'Filipino BL', 'BL', 'BL Kiss', 'BoysLove Kiss', 'LGBT', 'GAy', 'AidenxDanny', 'yaoi', 'BoyxBoy', 'Boyslove', 'intimate']",ID
vf5bmqOAu0U,Horimiya Full Trailer | Filipino-dubbed Anime | POP TV PH,UCXylm9JVPrbJAiJTTmvyLqQ,"POPTV Pinas: Sine, Serye, Anime",[],PH
eSSqgBwp7jo,Indo React VJBROS Winning Performance in SMA PH Dance To Your Seoul (EXO - The Eve + MAMA + Monster),UCY34lthm09Al2f6BULI3dkQ,YouTube React - ytreact,"['VJBROS Winning Performance in SMA PH Dance To Your Seoul (EXO - The Eve + MAMA + Monster)', 'SMA PH | Dance To Your Seoul in SM Fairview [Highlights] | REACTION VIDEO!', 'STAR HUNT ACADEMY TRAINEES -Performance (PBB8 CELEBR8 at the BIG NIGHT)', 'Indonesian Reacts to [0829] Happy Hallyu Day 4 - Star Hunt Boy Trainees Performance | REACTION!', 'YouTube React- ytr', 'first one ttak maju', 'first one', 'vj bros', 'vj bros grand price winner', 'ytreact', 'ytreact youtube react', 'YouTube React', 'First One']",ID
CQPMDFloe_s,Indonesian React! Can Filipinos Speak Their Own Language? (Tagalog Challenge) | ASIAN BOSS REACTION!,UCY34lthm09Al2f6BULI3dkQ,YouTube React - ytreact,"['ONLINE TAGALOG COURSE! Indonesian Reacts to Similarities Between Filipino and Indonesian | REACTION!', 'How Similar are Tagalog and Indonesian?', 'Langfocus', 'Free Tagalog Course with SB19! Indonesian Reacts to VLOG SB19 on Awit Awards + Game | REACTION VIDEO', 'SB19 Hanggang sa Huli', 'Indonesian Reacts to Hanggang sa Huli by SB19 | #TMFunPinoyTambayan LIVE EP4 | REACTION!', 'YouTube React- ytreact', 'Indonesian Reacts to FILIPINA ACTRESS VS. INDONESIAN ACTRESS FACE OFF! | REACTION VIDEO!', 'tagalog', 'ind']",ID
e3EHFW59a84,"Tiny Tropical House  built by Foreigner in Philippines, Nipa House Inside Tour/ Modern Bahay Kubo",UCYAgCuUsaqAcCZfXn9praOQ,WM official channel,"['Modern Bahay Kubo', 'Tropical Lifestyle', 'Foreigner in Philippines', 'Tiny house Living', 'Tiny House', 'Beach', 'Ocean', 'Nipa House', 'House Tour', 'Simple Living', 'Bamboo House', 'Rattan', 'How to Build a Cheap House', 'Small House', 'Tiny House Design']",Unknown
O1repYZQA3I,"NewJeans reaction when Melai said ""My daughter loves NJ"" at AAA2023(Asia Artist Award).",UCYBSjLJu35cOuWgKBBdTCug,NewJeans Zone,"['AAA2023', 'asia artist award', 'NewJeans at aaa2023', 'NewJeans']",TH
JkA9tkY1phY,Arriving in the PHILIPPINES for the FIRST TIME (MANILA)  🇵🇭,UCYC6B6DMhDUTQQrwgD0CwOw,The Hutchinsons,"['Full time family travel', 'Family world travel', 'world travel', 'family of five', 'family', 'family vlogs', 'family daily vlogs', 'best family vlogs', 'family vlogger', 'uk family', 'british family', 'family friendly', 'The Hutchinsons', 'Family Youtube', 'Family Vlogging', 'Uk Family Vlogs', 'Uk Vlogging', 'UK', 'Vlog', 'Vloggers', 'Family love', 'Travelling', 'Travelling family', 'Full time travellers', 'our first day in manila', 'the philippines', 'manila']",Unknown
j8_2lHTrXmI,Bituing Marikit by Lara Maigue (Soprano) - Tagalog Kundiman - [Filipino Love Song - Pinoy Cover],UCYCy8prsYhjMTh-rwln9Kmg,Hoy Tara! ,"['filipino kundiman', 'bituing marikit karaoke', 'bituing marikit song', 'cundiman', 'Pinoy love songs 20s', 'pinoy kundiman songs', 'lara maigue', 'filipino kundiman songs', 'famous soprano singers', 'famous soprano songs', 'famous soprano arias', 'filipino soprano singers', 'filipino soprano singers and their songs', 'soprano filipino female singers', 'pinoy soprano singers', 'philippine music traditional', 'philippine music video', 'famous philippines song', 'old pinoy songs']",PH
89fAweJCucA,American Trying Filipino Bulalo For First Time! Best Filipino Food in NJ!,UCYEjj738dusPO4hh2hLfLBQ,The World According To Jason,"['best filipino food', 'best filipino food in new jersey', 'best filipino food in nj', 'comfort food', 'filipino crispy pata', 'filipino food', 'filipino food cooking', 'filipino food review', 'filipino mukbang', 'food from the philippines', 'lumpiang shanghai', 'pata', 'pinoy food', 'pinoy food mukbang', 'pinoy food reaction', 'pinoy food review', 'sukang sawsawan', 'tofu sisig panlasang pinoy', 'food review', 'food porn', 'foreigners trying filipino food', 'filipino food reaction', 'bulalo', 'first time trying bulalo']",US
8aIOhuGMhaA,American Trying Filipino Crispy Pata For First Time! Best Filipino Food in NJ!,UCYEjj738dusPO4hh2hLfLBQ,The World According To Jason,"['american trying filipino crispy pata', 'best filipino food', 'best filipino food in new jersey', 'best filipino food in nj', 'comfort food', 'crispy pata', ""fi'co filipino flavorzz"", 'filipino crispy pata', 'filipino food', 'filipino food cooking', 'filipino food review', 'filipino mukbang', 'food from the philippines', 'lumpiang shanghai', 'pata', 'pinoy food', 'pinoy food mukbang', 'pinoy food reaction', 'pinoy food review', 'sukang sawsawan', 'tofu sisig', 'tofu sisig panlasang pinoy', 'food review', 'food porn']",US
zsOJPWe0ZuQ,Hashiras reacts to Philippines Part 1 (8 days in PH),UCYKRagH3Wh5SqY39EL8wRWw,Akina,[],Unknown
9NgEykaN-xU,Trying FILIPINO FOOD for the FIRST TIME! 🇵🇭,UCYLE90leCKiyCqZgKjOExCw,Calvin & Jess,"['filipino food', 'filipino street food', 'best filipino food', 'trying filipino food', 'trying filipino food first time', 'mukbang philippines', 'mukbang filipino food', 'mukbang', 'couples channels', 'couple youtube channel', 'couples youtubers', 'filipino food mukbang', 'daily vlog', 'india', 'sisig and pancit mukbang', 'authentic filipino cuisine', 'filipino mukbang', 'food reaction video', 'filipino food review', 'americans try filipino snacks', 'calvin and jess', 'charles and alyssa', 'kb and karla', 'juju and des']",US
scfxw0VfxTY,MC Hariel - Saudades Feat. MC IG e MC PH (GR6 Explode) - LAZER DOS CRIA REACT,UCYLTF_WZRI117J8TGOOfrdA,Lazer dos cria,[],Unknown
QVZTbUNPEWk,"''4M Vibes'' - MC IG, MC PH, MC Hariel, MC Pedrinho, MC Davi, MC Leh e Luki - LAZER DOS CRIA REACT",UCYLTF_WZRI117J8TGOOfrdA,Lazer dos cria,"['4m vibes react', 'mc ig', 'mc ph', 'mc hariel', 'mc pedrinho', 'mc davi', 'mc leh', 'lazer dos cria', 'lazer dos cria react', 'gr6 explode', 'gr6 explode react']",Unknown
rm5Q8Uubc9k,MC PH - Os Bico Tão Se Perguntando (Clipe Oficial) (GR6 Explode) - LAZER DOS CRIA REACT,UCYLTF_WZRI117J8TGOOfrdA,Lazer dos cria,[],Unknown
EE-ZsGvUAR4,Foreigner - I Want To Know What Love Is 2010 Live Video HD,UCYMEOGcvav3gCgImK2J07CQ,NEA ZIXNH,"['Foreigner', 'Britis American Band', 'Musical Group', 'Mick Jones', 'English Musician', 'Country', 'England', 'British', 'United Kingdom', 'UK', 'Lou Gramm', 'New York', 'NYC', 'USA', 'Song', 'Single', 'Album', 'Live', 'Concert', 'Ryman Auditorium', 'Nashville', 'Tennessee', 'TN', 'Official', 'Original', 'Hits', 'Best Hits', 'Greatest Hits', 'Top Hits', 'Pop', 'Classic Rock', 'Charts', 'Billboard', 'TV Show', 'MTV', 'Grammy Award', 'Hard Rock', 'Soft Rock', 'Blues Rock', 'Power Ballad', 'Progressive', 'Power', 'Rock', 'Music', 'Video', 'Clip', 'Full', 'HD', '1080p', 'Sound HQ', 'You Tube']",Unknown
iIDK5pnMsBo,Hugot Pampaiyak OPM Original Filipino Pinoy Music Acoustic Songs Cover Pampatulog 2021 Compilation,UCYSMSCjr51zY2kUdOOyNctA,Kape Break Studios,"['Hugot', 'Hugot songs 2021', 'Pampaiyak songs 2021', 'pampaiyak love songs 2021', 'pampaiyak opm songs', 'wish 107.5 pampaiyak playlist', 'wish 107.5 pampatulog playlist', 'wish 107.5 pampaiyak compilation', 'wish 107.5 hugot compilation', 'wish 107.5 hugot songs 2021', 'opm pampatulog compilation', 'wish 107.5 hugot 2021', 'wish 107.5 hugot 2021 compilation', 'pampaiyak', 'pampatulog', 'pamparelax', 'opm covers', 'best opm covers 2021', 'best hugot songs 2021', 'pampaiyak na kanta', 'ang sakit na songs 2021', 'hugot songs']",PH
wmvRBLjIHu4,"Dec 18, 2023! 🇵🇭CarL Jammes Martin  VS.  🇹🇭Chaiwat Buatkrathok Full Fight Highlights❗6 ROUND T.K.O",UCYTn1RHWemOQP3qVMbaKsdQ,PB SPORTS,"['Pinoy boxer', 'Boxing', 'Pinoy boxing latest fight 2021', 'Boxing highlights', 'Sports', 'Sports boxing', 'Highlights fight', 'Boxing news', 'Latest sports', 'Sports knockout', 'Boxing full fight', 'Boxing today', 'Latest boxing', 'Boxing trending', 'Knockout', 'Boxing legend', 'Boxing champion', 'World champion', 'Sports news', 'Sports live', 'Pinoy sports', 'Professional Boxing']",PH
KRdus7G2xA0,KOREAN FAMILY ENJOYS LECHON BELLY IN MY 33RD BDAY | BALAT PALANG PANALO NA👍 | FILIPINO FOOD,UCYVEmKA1m5Y6TiErpVv1RnQ,lucky doyun channel,"['korean tried filipino food', 'korean tried lechon belly', 'lechon belly', 'pork belly', 'lechon', 'filipino food', 'birthday']",KR
JK7a1hZBVMw,KOREAN FAMILY ENJOYS PORK HUMBA BISAYA |LEGIT NAPAEXTRA RICE SA SARAP! | FILIPINO FOOD,UCYVEmKA1m5Y6TiErpVv1RnQ,lucky doyun channel,"['korean filipino family', 'korean tried filipino food', 'korean tried pork humba', 'pork humba', 'humba', 'filipino food']",KR
hgBgdXzgxvo,KOREAN FAMILY TRIED PORK EMBUTIDO | GALIT GALIT MUNA SA SOBRANG  SARAP | EMBUTIDO | FILIPINO FOOD,UCYVEmKA1m5Y6TiErpVv1RnQ,lucky doyun channel,"['korean filipino family', 'korean tried filipino food', 'korean tried embutido', 'embutido', 'filipino food']",KR
v-lvFrySsxk,FILIPINO STYLE SPAGHETTI  FOR MY KOREAN HUSBAND 42'nd BIRTHDAY | FILIPINO FOOD,UCYVEmKA1m5Y6TiErpVv1RnQ,lucky doyun channel,"['korean filipino family', 'korean tried filipino food', 'filipino style spaghetti', ""42'nd birthday celebration"", 'filipino food']",KR
nzut0GFoZ6E,KOREAN GOES TO PHILIPPINES 🇵🇭 🇰🇷 | MY MOTHER-IN-LAW  FIRST TIME IN PHILIPPINES | KAPAGOD PALA!,UCYVEmKA1m5Y6TiErpVv1RnQ,lucky doyun channel,[],KR
0QYLZGBG-5Q,TOP 46 FOREIGNER YOUTUBERS (PHILIPPINES) | Ranked by number of subscribers,UCYWtfSnOqE7okWNx2V1RPIw,Honeyduke,"['philippines', 'filipino', 'the hungry syrian wanderer', 'wil dasovich', 'fumishun base', 'dwaine woolley', 'doc adam', 'bisayang hilaw', 'becoming filipino', 'music game news', 'finnsnow', 'happy reactions', 'bubs & doe', 'juicy vlog', 'make it happen vlog', 'itskevo', '123japan', 'top', 'foreigner', 'vlogger', 'reactor', 'youtuber', 'data', 'statistics']",PH
5cJvynokHpg,Top Christmas Songs Playlist 🎅🏼 Best Christmas Music Playlist 🎄 Merry Christmas 2023,UCYXIviXPAaaaU_AOotpXTAw,Revive Music,[],US
B20q2zJ8TbU,Top Christmas Songs Playlist 🎅🏼 Best Christmas Music Playlist 🎄 Merry Christmas 2023,UCYXIviXPAaaaU_AOotpXTAw,Revive Music,[],US
pVi_0uV4oO4,Our Baby Trying Philippines Mango for the First Time! (Hilarious Reaction!),UCYY2mNcq7pv6IRW92JIT6DA,The Juicy Vlog,[],GB
5gwTgaGCyYE,"First Time in MANILA, Philippines! British Couple REACT",UCYY2mNcq7pv6IRW92JIT6DA,The Juicy Vlog,"['filipino life', 'filipino people', 'the philippines', 'palawan', 'travel palwan', 'filipina', 'philippines vlog', 'filipino vlog', 'filipino', 'living in the philippines', 'philippines ex pats', 'british couple first time in philippines', 'what to do in palawan', 'filipino girls', 'filipino food', 'philippines travel guide', 'foreigners in the philippines', 'travel vlog', 'the juicy vlog', 'manila', 'first impression of manila', 'didnt expect this in philippines']",GB
uZ2KNNuK2B4,CANADA in The PHILIPPINES?! British Couple Trying Tim Hortons for FIRST TIME,UCYY2mNcq7pv6IRW92JIT6DA,The Juicy Vlog,[],GB
8M5VTBEQGso,Foreigner Reaction To FILIPINO FOOD!,UCYY2mNcq7pv6IRW92JIT6DA,The Juicy Vlog,"['filipino food', 'filipino batchoy', 'batchoy iloilo', 'iloilo city', 'filipino', 'the philippines', 'living in the philippines', 'philippines ex pats', 'british couple first time in philippines', 'filipino girls', 'philippines travel guide', 'foreigners in the philippines', 'travel vlog', 'the juicy vlog', 'making it juicy', 'making it juicy on the road', 'making it happen vlog', 'mike and nelly']",GB
O-fsQqR5z4s,"Foreigners First Time in BATANES, Philippines! We Didn't Expect THIS!",UCYY2mNcq7pv6IRW92JIT6DA,The Juicy Vlog,"['filipino', 'the philippines', 'living in the philippines', 'british couple first time in philippines', 'filipino girls', 'filipino food', 'philippines travel guide', 'foreigners in the philippines', 'travel vlog', 'the juicy vlog', 'making it juicy', 'making it juicy on the road', 'making it happen vlog', 'daily vlog', 'batanes', 'batanes philippines', 'batanes vlog']",GB
EQEGUVwxaiI,Our First Time In The Philippines! Did We Really Think This?!,UCYY2mNcq7pv6IRW92JIT6DA,The Juicy Vlog,"['filipino', 'the philippines', 'living in the philippines', 'philippines ex pats', 'british couple first time in philippines', 'filipino girls', 'filipino food', 'philippines travel guide', 'foreigners in the philippines', 'travel vlog', 'the juicy vlog', 'making it juicy', 'making it juicy on the road', 'making it happen vlog', 'daily vlog', 'daily travel vlog']",GB
0z_UIEHwskI,"SINULOG 2019 Philippines, Foreigners First Time!",UCYY2mNcq7pv6IRW92JIT6DA,The Juicy Vlog,"['filipino', 'the philippines', 'living in the philippines', 'philippines ex pats', 'british couple first time in philippines', 'filipino girls', 'filipino food', 'philippines travel guide', 'foreigners in the philippines', 'travel vlog', 'the juicy vlog', 'sinulog', 'sinulog 2019', 'finn snow', 'making it juicy', 'sinulog festival', 'cebu']",GB
35THbgakNBk,Foreigners PERFORM CONCERT In Philippines Shopping Mall!,UCYY2mNcq7pv6IRW92JIT6DA,The Juicy Vlog,"['philippines shopping mall', 'manila', 'manila shopping mall', 'filipino shopping mall', 'filipino', 'the philippines', 'living in the philippines', 'philippines ex pats', 'british couple first time in philippines', 'filipino girls', 'filipino food', 'philippines travel guide', 'foreigners in the philippines', 'travel vlog', 'the juicy vlog', 'making it juicy', 'making it juicy on the road']",GB
2PUZu5SE83s,First Time In SIQUIJOR Philippines! Is This REAL PARADISE?,UCYY2mNcq7pv6IRW92JIT6DA,The Juicy Vlog,"['filipino life', 'filipino people', 'the philippines', 'filipina', 'philippines vlog', 'filipino vlog', 'filipino', 'living in the philippines', 'philippines ex pats', 'british couple first time in philippines', 'filipino food', 'philippines travel guide', 'foreigners in the philippines', 'travel vlog', 'the juicy vlog', 'philippines island hopping', 'making it juicy', 'siquijor', 'siquijor island', 'filipino paradise', 'ferry to siquijor', 'siquijor vlog', 'flight to siquijor']",GB
zl071FhqyJI,"Foreigners Find SECRET LOCAL Cold Springs In BOHOL Philippines, No Tourists!",UCYY2mNcq7pv6IRW92JIT6DA,The Juicy Vlog,"['filipino', 'the philippines', 'living in the philippines', 'british couple first time in philippines', 'filipino food', 'philippines travel guide', 'foreigners in the philippines', 'travel vlog', 'the juicy vlog', 'bohol', 'bohol vlog']",GB
Omu6RFJ_7yE,"Foreigners React To TAGAYTAY City, Philippines! Exploring South Luzon",UCYY2mNcq7pv6IRW92JIT6DA,The Juicy Vlog,"['filipino', 'the philippines', 'living in the philippines', 'philippines ex pats', 'british couple first time in philippines', 'filipino girls', 'filipino food', 'philippines travel guide', 'foreigners in the philippines', 'travel vlog', 'the juicy vlog', 'making it juicy', 'making it juicy on the road', 'tagatay', 'south luzon', 'taal volcano']",GB
WQIFuWt7KzM,8 Misconceptions Foreigners Have About The Philippines,UCYY2mNcq7pv6IRW92JIT6DA,The Juicy Vlog,[],GB
N3Cit-AE43o,Foreigners ONLY EAT JOLLIBEE for 24HOURS in Philippines!!,UCYY2mNcq7pv6IRW92JIT6DA,The Juicy Vlog,"['filipino', 'the philippines', 'living in the philippines', 'british couple first time in philippines', 'filipino food', 'philippines travel guide', 'foreigners in the philippines', 'travel vlog', 'the juicy vlog', 'jollibee', 'trying jollibee', 'foreingers try jollibee']",GB
8-sOXjszF4E,"DINAGYANG 2019 Philippines, Foreigners First Time!",UCYY2mNcq7pv6IRW92JIT6DA,The Juicy Vlog,"['dinagyang', 'dinagyang 2019', 'dinagyang festival', 'philippines festival', 'filipino', 'the philippines', 'living in the philippines', 'philippines ex pats', 'british couple first time in philippines', 'filipino girls', 'filipino food', 'philippines travel guide', 'foreigners in the philippines', 'travel vlog', 'the juicy vlog', 'making it juicy', 'making it juicy on the road']",GB
_XGyyuBHo0o,Trying FILIPINO ALCOHOL For The First Time Part 2 (It gets crazier!),UCYY2mNcq7pv6IRW92JIT6DA,The Juicy Vlog,[],GB
A07-gmV4Mos,Why We LOVE Cebu! Meeting Amazing Filipino Subscribers,UCYY2mNcq7pv6IRW92JIT6DA,The Juicy Vlog,"['filipino', 'the philippines', 'living in the philippines', 'british couple first time in philippines', 'filipino food', 'philippines travel guide', 'foreigners in the philippines', 'travel vlog', 'the juicy vlog', 'first reaction to philippines', 'foreigner reaction to philippines', 'philippines vlogger']",GB
fTnaZwbgRCE,British Couple Trying FILIPINO STREET FOOD With a TWIST! Local Manila FEAST,UCYY2mNcq7pv6IRW92JIT6DA,The Juicy Vlog,[],GB
NRVvumC3hY8,"Cooking Filipino Food For My British Family! (First Time Trying Adobo, Sinigang & Turon)",UCYY2mNcq7pv6IRW92JIT6DA,The Juicy Vlog,[],GB
bQdfoCTjU7E,Trying FILIPINO ALCOHOL For the First Time! (this is INSANE),UCYY2mNcq7pv6IRW92JIT6DA,The Juicy Vlog,[],GB
rvToEKQvF50,Foreigners DRIVING To NORTH Philippines!,UCYY2mNcq7pv6IRW92JIT6DA,The Juicy Vlog,"['filipino', 'the philippines', 'living in the philippines', 'philippines ex pats', 'british couple first time in philippines', 'filipino girls', 'filipino food', 'philippines travel guide', 'foreigners in the philippines', 'travel vlog', 'the juicy vlog', 'making it juicy', 'making it juicy on the road', 'manila', 'back in manila', 'first time in manila', 'juicy vlog philippines', 'daily juice', 'north philippines', 'northern philippines', 'north luzon', 'luzon', 'baguio', 'alaminos', 'vigan', 'road trip', 'philippines road trip']",GB
QRd5Hclfpdk,Foreigners LIVE with Friendliest Filipino Family!,UCYY2mNcq7pv6IRW92JIT6DA,The Juicy Vlog,"['filipino life', 'filipino people', 'the philippines', 'cebu', 'palawan', 't ravel palwan', 'filipina', 'philippines vlog', 'filipino vlog', 'filipino', 'living in the philippines', 'philippines ex pats', 'el nido', 'british couple first time in philippines', 'what to do in palawan', 'filipino girls', 'filipino food', 'philippines travel guide', 'foreigners in the philippines', 'travel vlog', 'the juicy vlog']",GB
7WsksXmb3CQ,Why Foreigners LOVE The Philippines!,UCYY2mNcq7pv6IRW92JIT6DA,The Juicy Vlog,"['the philippines', 'phillipines', 'palawan', 'port barton', 'el nido', 'island hopping', 'filipino', 'living in the philippines', 'philippines ex pats', 'british couple first time in philippines', 'what to do in palawan', 'what to do in el nido', 'filipino girls', 'filipino food', 'philippines travel guide', 'foreigners in the philippines', 'travel vlog', 'the juicy vlog', 'what to do in port barton']",GB
sRX0LWY7eCE,"Foreigners REACT To Iloilo Philippines, City Of LOVE?!",UCYY2mNcq7pv6IRW92JIT6DA,The Juicy Vlog,"['filipino', 'the philippines', 'living in the philippines', 'british couple first time in philippines', 'filipino food', 'philippines travel guide', 'foreigners in the philippines', 'travel vlog', 'the juicy vlog', 'daily vlog', 'iloilo', 'iloilo city', 'city of love']",GB
xEC_W6DHRjk,"CRAZY BULLET TRAIN in Japan! Osaka To Kyoto, First Time REACTION",UCYY2mNcq7pv6IRW92JIT6DA,The Juicy Vlog,"['filipino', 'the philippines', 'living in the philippines', 'british couple first time in philippines', 'filipino food', 'philippines travel guide', 'foreigners in the philippines', 'travel vlog', 'the juicy vlog', 'first reaction to philippines', 'foreigner reaction to philippines', 'philippines vlogger']",GB
CSudMK6zveA,🇵🇭#philippines#series pt 1 💪 IS THE🇵🇭 #philippines ❤SAFE #filipino #security #foreigner#retirement,UCYZGzORreG0S452i5UIjItA,Philippines One Love,[],Unknown
