Video Id,Video Title,Channel Id,Channel Title,Video Tags,Channel Country
pgyCi7W-gbg,Marine reacts to Philippine Special Forces in Marawi,UCUB6A2YY9soreMGNwDLh-zw,Combat Arms Channel,"['filipino', 'special', 'forces', 'operations', 'sf', 'battle', 'marawi', 'philippines', 'battling', 'us', 'marine', 'reacts', 'reaction', 'combat', 'arms', 'channel', 'military', 'army', 'soldier']",US
QeKYdEWg51k,Marine reacts to the Philippine Scout Rangers,UCUB6A2YY9soreMGNwDLh-zw,Combat Arms Channel,"['marine', 'us', 'american', 'reacts', 'reaction', 'scout', 'rangers', 'philippines', 'philippine', 'filipino', 'army', 'military', 'react', 'soldier', 'documentary', 'training']",US
YZIhXFDH4ek,"Pretty Russian girl sings FILIPINO song ""Hanggang"" w/David DiMuzio",UCUBYHxfhpoDKcel_aAm51wg,David DiMuzio,"['Hanggang', 'Girl', 'Wency Cornejo', 'Foreigners sing tagalog song', 'David DiMuzio', 'Filipino song', 'pretty russian', 'Anna Rabtsun', 'Philippines', 'I LOVE OPM', 'dimuzio', 'david', 'Pinoy', 'Foreigner', 'song', 'filipino', 'always', 'official music video', 'Russia', 'pretty russian girl sings', 'Country', 'Di ko magagawang', 'Scandal', 'mo sanang isiping', 'Giliw wag mo', 'abscbn', 'OPM', 'wag mo sanang']",US
BxH_ALm9f2o,First time cooking Banana Turon #pinoystyle #bananaturon #outdoorcooking #bahaykubo#philippines,UCUELtp8K4Cl62E19rCjoMuQ,Jelicious Diet,[],Unknown
yU2wkD-gbzI,What English Sounds Like To Non-English Speakers,UCUEbbWqlF-yZwmNah9STfBw,GC,"['what', 'english', 'sounds', 'like', 'for', 'to', 'non', 'speakers', 'foreigners', 'non-speakers', 'language']",Unknown
YXpOSLVBRa4,Ito pala ang VIRAL na SPEECH ni Daniel Padilla sa Asia Artists Award 2023 kasama si Kathryn Bernardo,UCUF2pX2Tein3t__JDUXlt6Q,Chika Blockbuster,"['daniel', 'padilla', 'asia artist award 2023', 'aaa fabulous award', 'kathryn bernardo', 'viral', 'speech', 'showbiz', 'news', 'chika blockbuster', 'kmjs', 'asia artist awards 2023', 'dec 14 2023']",PH
j_8oBmmjvC4,Kathryn Bernardo GOT THE LOUDEST SCREAM at Asia Artist Award 2023 for winning the AAA FABULOUS AWARD,UCUF2pX2Tein3t__JDUXlt6Q,Chika Blockbuster,"['kathryn', 'bernardo', 'aaa', 'asia artist award 2023', 'showbiz', 'news', 'chika blockbuster', 'kmjs', 'dec 14 2023', 'aaa fabulous award']",PH
comy8FWCy0k,Trying Filipino food │Tagalog Vlog,UCUF33-NJSyT9Ypst-mZ6pTQ,Karolina Major,"['Filipino', 'Food', 'makati', 'Foreign', 'Sisig', 'Sinigang']",PH
CQZZn9-RgAk,Foreigner telling the truth in the Philippines,UCUGxiJ13iRVRiypo8mT5r7g,Joe Gilbert,[],PH
2OT5Pcl4iF0,TRYING FILIPINO RUM for the FIRST TIME! THINGS GOT WILD!,UCUI4T7riAxLPSV4htxMFLqw,Robyn Kimberly,"['TRYING FILIPINO RUM for the FIRST TIME! THINGS GOT WILD!', 'filipino rum', 'TRYING FILIPINO RUM for the FIRST TIME', 'taste Filipino alcohol for the first time', 'filipino alcohol taste test', 'foreigner trys filipino alcohol', 'trying filipino alcohol', 'foreigner trying filipino alcohol', 'first time trying filipino alcohol', 'trying out filipino alcohol', 'robyn kimberly', 'siargao travel vlog 2020', 'robyn kimberly siragao', 'its more fun in the philippines 2020', 'philippines travel vlog 2020', 'Siargao']",CA
w7W6NcwvFic,FOREIGNER tries FILIPINO COFFEE for the FIRST TIME!! Siargao Island,UCUI4T7riAxLPSV4htxMFLqw,Robyn Kimberly,"['FOREIGNER tries FILIPINO COFFEE for the FIRST TIME!! Siargao Island', 'FOREIGNER tries FILIPINO COFFEE for the FIRST TIME', 'robyn kimberly', 'foreigner tries filipino food', 'foreigner tries filipino street food', 'Siargao Island', 'Philippines travel tips', 'living in the philippines 2019', 'philippines travel 2019', 'trying filipino food mukbang', 'filipino food recipes', 'filipino food mukbang kamayan', 'filipino food', 'pinoy food mukbang', 'travel vlog airport', 'cost of living in the philippines 2019']",CA
aRVWwPgSOkk,"SIARGAO, PHILIPPINES day in my LIFE! foreigner lives in Philippines",UCUI4T7riAxLPSV4htxMFLqw,Robyn Kimberly,"['robyn kimberly', 'PHILIPPINES day in my LIFE! foreigner lives in Philippines', 'malinao beach siargao', 'SIARGAO', 'PHILIPPINES day in my LIFE', 'foreigner lives in Philippines', 'siargao island vlog', 'siargao island philippines', 'siargao island', 'travel philippines', 'living in the philippines 2019', 'philippines vlog 2019', 'philippines travel 2019', 'travel philippines 2019', 'travel vlogger', 'philippines vlog', 'travel philippines manila', 'philippines travel guide', 'travel philippines on a budget']",CA
tRy6Yd4JFJ8,Growing Up With Filipino Parents // Jessica Q,UCUN5bhs8op8hI2OAinqdOcw,jessica q,"['filipino parents', 'filipino', 'philippines', 'filipino youtuber', 'jessica q', 'growing up with filipino parents', 'skit', 'things filipino moms say', 'things filipino dads say', 'things filipinos say', 'filipino sterotypes', 'filipino video', 'filipino youtube', 'entertainment', 'youtuber']",Unknown
6a4xQ7NePZI,Foreigner finds Paradise in Leyte Philippines 🇵🇭🌳💦 #river #swimming #paradise #philippines #travel,UCUNTc4FIPAMv-Uvi0ZPH9mw,ExploreWithTorale,[],Unknown
NQOcZfSy-4Y,Prey Final Battle Predator Vs Naru Fight Scene Ending And Best Scenes HD,UCUOEqTvCR9HgxtJmH9nTARQ,Buggo,"['prey final battle', 'predator final battle', 'final battle', 'prey final battle predator vs naru fight scene ending and best scenes hd', 'final', 'predator battle scene', 'the suicide squad final battle', 'final boss', 'finale', 'boss battle', 'black panther final battle black panther vs killmonger fight wakanda battle scene hd', 'prey final cutscene', 'prey 2017 final cutscene', 'prey final boss and ending', 'final fight', 'prey 2006 | final fight & ending', 'harley quinn final fight scene']",US
v0rl3luOW5k,Filipino Foods Foreigners Miss Most (Ilonggo),UCURxbW0Y5s_Y5QkwOag-_zQ,Friends in All Nations- Filipino,"['Filipino', 'food', 'Foreigners', 'ilonggo', 'boyz']",US
ejRYyNqYNr8,"Creepypasta react to my favorite tiktok part two ft: fnaf, countryhumans Philippines",UCUTMCzyyCKmGT4B3ICerzog,lxsynvnnie,[],Unknown
8pQ_Yg_UwFg,First time listening to🇵🇭FLOW G - RAPSTAR | UK🇬🇧REACTION,UCUULPWnsQKl77LdYxJTbYtA,ElyasReacts,"['FLOW G - RAPSTAR reaction', 'Filipino rapper', 'hip hop music', 'trap music', 'trap song', 'rap song', 'Artist from the Philippines', 'First time listening to philippine music', 'flow g', 'flow g reaction', 'flow g rapstar reaction', 'rapstar', 'flow g rapstar', 'first time listening to philippine music', 'artist from the philippines', 'filipino rapper', 'rapstar flow g', 'rapstar flow g reaction video', 'rapstar reaction', 'rapstar flow g reaction', 'flow g - rapstar (official music video) reaction']",GB
Mps3y4fnZBo,TRYING FILIPINO FOOD,UCUWhWgXOjE1ET2CRRtgcnQw,Oli White,"['Oli White', 'OliWhiteTV', 'british', 'mens lifestyle', 'fashion', 'british youtuber', 'funny video', 'relatable', 'Joe Sugg', 'Caspar Lee', 'Manila', 'Phillippines', 'Filipino', 'Food', 'Trying food', 'Trying Filipino Food']",GB
P7QOk8M4i-A,FIRST TIME LISTENING TO SB19 (GENTO + CRIMZONE + MANA + BAZINGA LIVE PERFORMANCE STAGE AAA 2023),UCU_S44_TIjz61VjYLbuWutQ,Featuring Big Brotha,[],US
YE7uYXHJGHQ,KAIRI & COACH YEB DIHUJAT MENJADI FAKTOR KEKALAHAN! BAKAL KLUAR ONIC?! REACTION TIKTOK MOBILE LEGEND,UCU_scVgSTMPeKIXrl6F9vAw,BrandonKent Everything,"['tiktok', 'reaction tiktok', 'tiktok mobile legend', 'empaction', 'jonathan liandi', 'brandon kent', 'bkent', 'irrad', 'onic m5', 'kairi', 'coach yeb', 'juara m5', 'onic vs apbren']",ID
gIMG33stCC4,Lovely foreigner talks a Bangladeshi boy | how to speak in English | practice in English,UCUa83qis9-TDbSlVD0a5LiA,NK Minhaj English,[],BD
jjfscrmmUF0,Foreigner At The Wet Market Philippines,UCUb_Ryp4MZHWnsTOVTA3txA,Pirate Cove Philippines,"['Philippines', 'Philippines visas', 'tourist visa', '13A permanent resident visa', 'Balikbayan visa', 'balikbayan Privilege', 'SRRV', 'American living in the philippines', 'living in the philippines', 'american living abroad', 'living abroad', 'immigration', 'Philippines immigration', 'culture', 'culture diversity', 'cultural differences', 'Luzon', 'living in luzon', 'american living in luzon', 'Malolos', 'Malolos Bulacan', 'island', 'island living', 'anerican living on an ialand', 'Filipina', 'married to a Filipina', 'Filipino Culture']",PH
p8h1aFve05E,Angry Foreigner in the Philippines,UCUb_Ryp4MZHWnsTOVTA3txA,Pirate Cove Philippines,"['Philippines', 'Philippines visas', 'tourist visa', '13A permanent resident visa', 'Balikbayan visa', 'balikbayan Privilege', 'SRRV', 'American living in the philippines', 'living in the philippines', 'american living abroad', 'living abroad', 'immigration', 'Philippines immigration', 'culture', 'culture diversity', 'cultural differences', 'Luzon', 'living in luzon', 'american living in luzon', 'Malolos', 'Malolos Bulacan', 'island', 'island living', 'anerican living on an ialand', 'Filipina', 'married to a Filipina', 'Filipino Culture']",PH
yFEr8FBwMbU,PH MOA React to TXT (투모로우바이투게더) 'Sugar Rush Ride' Official MV,UCUbv5Oxx28q1w5JJsa129WQ,Jemarich Arellano,[],Unknown
bV7VouL-xno,What is THIS?!! | Foreigner Tries Filipino Food in Seoul,UCUc0Q7oIblJ6_kSmX50iGoA,travelandtash,"['filipino food', 'filipino food in korea', 'foreigner tries filipino food', '테이스트 서울 굿', 'travelandtash', 'sisig', 'lechon', 'turmeric tea', 'pili nuts philippines', 'filipino food mukbang', 'feelthephil', 'food festival philippines 2019', 'food festival philippines', 'philippines street food festival', 'tastes seoul good', 'wrapsody.ynut', 'filipino food festival', 'foreigner tries filipino street food', 'filipino restaurant', 'mr bulbul', 'try filipino food', 'filipino festival in seoul', 'the philippines']",KR
ToWpKtouonM,| MHA REACTS TO PHILIPPINES | (My country),UCUfTW-3iKX5S-5_RO181aEA,•~Bloom Rosie~•,[],PH
yu29pvwbuBc,philippines tries gross ice cream,UCUgDRBGFehOMBwQqE_tXbwQ,Beatriz Virto,[],Unknown
86hNO929zIk,DO FOREIGNERS LIKE FILIPINO ICECREAM?,UCUk8aRBVog6G9ipBSN_Ow1g,biggy travels,"['DO FOREIGNERS LIKE FILIPINO ICECREAM?', 'biggytravels', 'biggy travels', 'ice cream', 'dirty icecream', 'filipino dirty icecream', 'filipino food', 'philippines', 'halo halo', 'icecream', 'filipino icecream sandwich', 'mamasons icecream', 'mamasons filipino', 'foreigners eat halo halo', 'filipino icecream', 'how to make icecream', 'icecream asmr', 'how to make filipino icecream', 'department of tourism philippi', 'tourism philippines', 'foreigners eat filipino icecream', 'dirty ice cream', 'xiaomanyc']",GB
ch3QACqOhEA,Asking Londoners to Pick Most Beautiful Filipino Celebrity?! 😍🤔,UCUk8aRBVog6G9ipBSN_Ow1g,biggy travels,"['filipino celebrity', 'filipino celebrities', 'filipino celebs', 'filipino', 'filipino actors', 'Asking Londoners to Pick Most Beautiful Filipino Celebrity', 'london', 'londoners', 'public reaction', 'pinoy', 'pinay', 'filipino celebrity news', 'filipino celebrity couples', 'filipino celebrity couples 2020', 'filipina', 'asking londoner', 'asking filipino questions', 'james reid', 'kathryn bernardo', 'dianne sison', 'bea alonzo', 'marian rivera', 'famous filipino', 'famous filipino celebrities', 'biggy travels', 'biggytravel']",GB
nMAO6hx8w6A,DO LONDONERS LIKE FILIPINO BBQ?,UCUk8aRBVog6G9ipBSN_Ow1g,biggy travels,"['DO LONDONERS LIKE FILIPINO BBQ', 'foreigners try filipino food', 'biggytravels', 'foreigners eating filipino foo', 'foreigners taste filipino food', 'foreigners love filipino food', 'quiapo street food', 'quiapo street market', 'filipino food reaction', 'filipino food', 'filipino bbq', 'filipino food recipe', 'filipino food list', 'what is filipino food like', 'how to cook filipino beef stea', 'how to cook filipino chicken c', ""what's filipino food"", 'what is filipino food', 'street food', 'filipino street food']",GB
fJVlMA3Fw_g,"🇵🇭 DO LONDONERS LIKE FILIPINO ICE CANDY? First time, Do They LOVE IT?! 🇵🇭 #filipinofood #london",UCUk8aRBVog6G9ipBSN_Ow1g,biggy travels,"['biggytravels', 'biggy travels', 'filipino food', 'filipino', 'pinoy', 'pinay', 'pinoy vlog', 'vlogger', 'filipino vlog', 'filipino vlogger', 'philippines', 'filipino food london', 'londoners try filipino', 'filipino food taste test', 'filipino food try by foreigners', 'foreigners try filipino food', 'filipino food reaction', 'foreigners react to filipino food', 'filipino food in america', 'filipino food in uk', 'british try filipino food', 'DO LONDONERS LIKE FILIPINO ICE CANDY? First time', 'philippines food']",GB
fkXeGKd-e0k,"VOCAL COACH and Singer React to Ben&Ben perform ""Leaves"" LIVE on Wish 107.5 Bus",UCUyDpu18SLNxJxMjJKFbNOA,Justin Burke,[],US
D-BJTvqCUtg,little FILIPINO girl with a BEAUTIFUL voice | Vocal Coach Justin Reacts #shorts,UCUyDpu18SLNxJxMjJKFbNOA,Justin Burke,[],US
NvXT3d5kz8E,"Filipinos are too good!! Vocal Coach Reacts to Stell, Zephanie, Janella Salvador - A Night of Wonder",UCUyDpu18SLNxJxMjJKFbNOA,Justin Burke,[],US
8wpjkSph6Ag,VOCAL COACH Reacts to Talented Filipina Singing I Will Always Love You at Mall this is INSANE,UCUyDpu18SLNxJxMjJKFbNOA,Justin Burke,[],US
rz1zMGfFR9c,VOCAL COACH and Singer React to Chandelier Showdown - Morissette Amon and Darren Espanto,UCUyDpu18SLNxJxMjJKFbNOA,Justin Burke,[],US
IOI7ktq0nPM,"VOCAL COACH and Singer React to Morissette Amon singing ""Akin Ka Na Lang"" LIVE on Wish 107.5 Bus",UCUyDpu18SLNxJxMjJKFbNOA,Justin Burke,"['morissette', 'morissette amon', 'morissette amon reaction', 'morissette amon reaction akin ka nalang', 'morissette reaction', 'morissette amon songs', 'morissette never enough', 'morissette amon rise up', 'morissette amon rise up reaction', 'never enough morissette', 'never enough', 'morissette amon akin ka nalang reaction', 'morissette akin ka nalang reaction', 'morissette akin ka nalang reaction vocal coach', 'akin ka na lang morissette amon', 'akin ka na lang morissette', 'akin ka na lang']",US
RbdCz7q95EU,Vocal Coach Reacts: FILIPINO KARAOKE - Limuel Llanes and Friends - That's What Friends Are,UCUyDpu18SLNxJxMjJKFbNOA,Justin Burke,[],US
y8C2lhGg4BI,Vocal Coach Reacts to INSANE Filipino LIVE CROWDS,UCUyDpu18SLNxJxMjJKFbNOA,Justin Burke,[],US
-F-WIYVBPlQ,Vocal Coach Reacts to Filipino Singer Arthur Nery - Rainbow (cover),UCUyDpu18SLNxJxMjJKFbNOA,Justin Burke,[],US
BfmXZTMaLQQ,"VOCAL COACH and Singer React to Michael Pangilinan performing ""Rainbow"" LIVE on Wish Bus",UCUyDpu18SLNxJxMjJKFbNOA,Justin Burke,"['Michael Pangilinan', 'Michael Pangilinan wish bus', 'Michael Pangilinan wish bus reaction', 'Michael Pangilinan reaction', 'Michael Pangilinan reaction rainbow', 'michael rainbow reaction', 'michael rainbow reaction vocal coach', 'michael rainbow', 'vocal coach', 'vocal coach reaction']",US
lHihuxBW8f4,"VOCAL COACH and Singer React to One Sweet Day - Cover by Khel, Bugoy, Daryl Ong and Katrina Velarde",UCUyDpu18SLNxJxMjJKFbNOA,Justin Burke,[],US
8HkaUYrpr0Y,VOCAL COACH Reacts to AMAZING Filipino Band AEGIS Performance (FOR THE FIRST TIME),UCUyDpu18SLNxJxMjJKFbNOA,Justin Burke,[],US
rj3yovL06n0,Powerful Filipino Singer Gigi De Lana - Angel baby | Vocal Coach Reaction,UCUyDpu18SLNxJxMjJKFbNOA,Justin Burke,[],US
9fShhSq25fA,"VOCAL COACH Reacts to Philippines’ Elha, Janine, Sheena & Zephanie - New Gen VOCAL DIVAS on ASAP",UCUyDpu18SLNxJxMjJKFbNOA,Justin Burke,[],US
XxF4I4wW6t8,Vocal Coach Reacts to SB19 Stell's INSANE TikTok Vocals | Live Song Cover Compilation,UCUyDpu18SLNxJxMjJKFbNOA,Justin Burke,[],US
bSw_doAilcY,"Vocal Coach reacts to Filipino Singers Justin Vasquez , JRoa , Arthur Nery -Rainbow",UCUyDpu18SLNxJxMjJKFbNOA,Justin Burke,[],US
CWNYR4f-Q14,Most dangerous country for women😨,UCUzAczCHLkamveIfpY1bCxw,ballsofearth,[],IN
99lvtsPtUUE,Trying to achieve my red hair dream 🧑‍🦰♥️ #redhair #newhairstyle #philippines #diyhairstyles #y2k,UCV0JxS6L0v0B9pA3lgqLf2w,Queenie Qhane,[],Unknown
U-oiJtbTD9Q,FOREIGNER TRAVELS TO WHITE BEACH PUERTO GALERA MINDORO PHILIPPINES,UCV34zLTn4A60jS8RTI96_sw,The Black Filipino TV,"['Puerto', 'Galera', 'Mindoro', 'Philippines', 'traveling', 'to', 'Manila', 'foreigner', 'Puerto Galera', 'White Beach', 'Beach', 'puerto galera philippines', 'tourism', 'things to do in the philippines', 'puerto galera 2019', 'puerto galera nightlife', 'wanderlusting', 'how', 'white beach puerto galera', 'oriental mindoro', 'southeast asia', 'places', 'visit', 'how to travel to puerto galera', 'near', 'baninay bautista vlog', 'happiness', 'happiness crossing', 'best of mindoro', 'explore', 'best islands in southeast asia', 'best', 'islands', 'in']",PH
6nBDx0RTbZU,FILIPINO GIRLS LOVE FOREIGNERS | TRIP TO THE MARKET |  Living in the Philippines,UCV34zLTn4A60jS8RTI96_sw,The Black Filipino TV,"['African', 'American', 'Expat', 'living', 'in', 'Manila', 'Philippines', 'working', 'as', 'Digital', 'Nomad', 'Living in the Philippines', 'Shopping in the Philippines', 'Markets in the Philippines', 'Filipino girls love foreigners', 'Land of opportunity', 'Sexy Filipino girls', 'Young Filipino girls', ""Filipina's"", 'Upwork', 'how to make money online', 'working online', 'how to work online', 'Work from home', 'make money from home', 'Married to a filipino', 'Girls in the Philippines', 'I love the philippines', 'foreigners', 'Beautiful girls']",PH
MQUbxkPd_dg,FOREIGNER INSULTED For Traveling To The Philippines For LOVE ❤️,UCV34zLTn4A60jS8RTI96_sw,The Black Filipino TV,"['philippines', 'life', 'in', 'the', 'living', 'dating', 'filipina', 'filipino', 'why', 'insulted', 'for', 'friends', 'American', 'UK', 'US', 'retired', 'savvy', 'expat', 'the black filipino tv', 'savvy expat', 'dating online', 'moving to the philippines', 'moving', 'long distance relationship', 'LDR']",PH
5PS7JlDoeAM,FOREIGNER’S LIFE Ruined By A FILIPINA | He Wanted To Play She Wanted More,UCV34zLTn4A60jS8RTI96_sw,The Black Filipino TV,"['philippines', 'life', 'living', 'ruined', 'by', 'filipina', 'filipino', 'why', 'who', 'UK', 'US', 'retired', 'expat', 'experience', 'american', 'the black filipino tv', 'foreigners', 'foreigner', 'how', 'love', 'hate', 'the philippines', 'metro manila', 'palawan', 'boracay', 'fun', 'filipinas']",PH
U99tRHb8qY8,"A DAY IN THE LIFE | Foreigner Living in the Philippines | Immigration, Meeting Filipinas & More",UCV34zLTn4A60jS8RTI96_sw,The Black Filipino TV,"['Philippines', 'Manila', 'Manila Philippines', 'Filipina', 'Filipinas', 'Filipino', 'Immigration', 'Immigration in the Philippines', 'Mass transit in the Philippines', 'Public transportation in Manila', 'Luke Mejares', 'Living in the Philippines', 'Traveling to the Philippines', 'Moving to the Philippines', 'Fruit', 'Meeting Filipinas', 'Beautiful Filipinas', 'Foreigners', 'Expat', 'American', 'Apartments', 'Condos', 'Vlogging', 'Vlogging in the Philippines', 'pinoy', 'Life in the Philippines']",PH
vZNJ0PE9d8g,Empires react to... | read description! lazy! |,UCV70R5lkhLuUgwrhWUfbsNw,ᥫ᭡ Kãwæìí–ñëkœ9 ᥫ᭡,[],Unknown
x5BUx-0AoTM,Countryhumans Philippines react to sunshine harem ships | read description |,UCV70R5lkhLuUgwrhWUfbsNw,ᥫ᭡ Kãwæìí–ñëkœ9 ᥫ᭡,[],Unknown
y5HlqjQxpaU,"MY BIG LOVE PART 1 , Kwentong Pambata ,  Bibiboo TV, Filipino Fairy tales,",UCV8Y9JaojlqVhQdGhXmb4Ig,Bibiboo TV,"['BIBIBOO TV', 'My Pingu Filipino', 'bibiboo', 'bibibo tv', 'bibibu tv', 'olympia', 'Bibiboo Story', 'bibu tv', 'alamat', 'pinoy stories', 'Filipino Fairy tales', 'Tagalog cartoons', 'Engkanto Story', 'THE RICH BOY AND HIS FAKE GIRLFRIEND', 'Kwentong pambata', 'mga kwentong pangbata', 'aswang', 'kwentong nakakatakot', 'kwentong pangbata', 'kwentong may aral', 'LIVING WITH VAMPIRES', 'bibibop tv', 'pinoy', 'MARA MANIKA', 'horror story', 'THE UNWANTED SISTER', 'axie', 'tulfo', 'play2earn', 'sad', 'MY BIG LOVE', 'MY BIG LOVE PART 1']",PH
EzdToSTaMjM,Foreigners FIRST IMPRESSIONS of the Philippines Manila,UCV9l2OvfTRuRaCpewolcAww,Just be free,"['street interview', 'foreigners about philippines', 'street interview in manila']",KZ
g7CpdlAtw-M,Foreigners FIRST IMPRESSIONS of the Philippines Manila 🇵🇭 (Honest Street Interviews),UCV9l2OvfTRuRaCpewolcAww,Just be free,"['street interview', 'street interview in manila', 'street intervew in the philippines', 'life in the philippines', 'foreigners first time in the philippines', 'first impressions of philippines', 'life in manila', 'foreigners about the philippines']",KZ
yJvHgcgUd2c,Foreigners Planting Rice In The Philippines (Ep. 7),UCVBn2I55zk8ToyfbK-4l0EQ,Island Media Asia,"['charlie sutcliffe', 'philippines', 'michael mcdonnell', 'pinoy', 'daniel marsh', 'pilipinas', 'henry edwards', 'filipino', 'matthew edwards', 'pilipino', 'brian wilson', 'tagalog', 'keys cosido', 'bisaya', 'funny', 'foreigner', 'foreigners', 'banyaga', 'tayo lang', 'selling', 'island media asia', 'nueva vizcaya', 'province', 'farm', 'field', 'farming', 'planting', 'rice', 'palay', 'Manila']",PH
IsMNvUsDPys,Foreigners Selling Balut in the Philippines (Ep. 4),UCVBn2I55zk8ToyfbK-4l0EQ,Island Media Asia,"['foreigners', 'selling', 'balut', 'vendors', 'tayo lang', 'half filipinos', 'makati', 'manila', 'metro manila', 'cebu', 'cebuano', 'bohol', 'pinoy', 'white guys', 'irish', 'canadian', 'english', 'british', 'canada', 'england', 'ireland', 'daniel marsh', 'charlie sutcliffe', 'michael mcdonnell', 'brian wilson', 'philippines', 'jobs', 'tagalog', 'funny', 'bisaya', 'visayan', 'visayas', 'island media', 'island media asia', 'chinos roces', 'fort bonafacio', 'greenbelt']",PH
9F4QhEaqDAI,day in the life - foreigner living alone in the philippines 🇵🇭,UCVDNARG4aJwgWzXJTAUqR9w,charlie’s lost,"['PHILIPPINES', 'LONDON TO MANILA', 'MANILA', 'UK TRAVEL', 'TRAVEL VLOG', 'PHILIPPINE VLOG', 'ANTIQUE', 'ANTIQUE PHILIPPINES', 'BRITISH IN PH', 'british in philippines', 'CEBU', 'HOUSE TOUR', 'APARTMENT TOUR']",PH
XjU9Di5POI0,Past countryhumans react to the Future || with 2 new guest || Part 2 || bonus scenes ||,UCVDibkjAbhel4ilMYL3-hxQ,Magic Studioz,[],Unknown
_KZvhIuNEOw,Past countryhumans react to future || Part 4 with a twist || countryhumans react || world history ||,UCVDibkjAbhel4ilMYL3-hxQ,Magic Studioz,[],Unknown
glDce9fBZOo,My react. tiktok ph #118,UCVGIh4EnAurvx9upbQ5gTJw,Unknow tiktok Ph,[],Unknown
H82XDYAznNM,Countryhumans react to Philippines meme||Gacha club||Part 3,UCVGkH1_CIfauwuHRDhdPqQA,chatherine alex,[],Unknown
XqYywZ0_Jy0,Countryhuman react to Philippines meme||part 2||Got Copyrighted,UCVGkH1_CIfauwuHRDhdPqQA,chatherine alex,[],Unknown
6vlzJFW-XGk,BLACKPINK - ‘Pink Venom’ M/V - WALWAL REACTION VIDEO | Ilonggo Blinks | Filipinos React,UCVGpJ19pOMMD-_Sk2ChfSqg,bulpingpang,"['BLACKPINK', 'PINK VENOM', 'BLINK', 'REACTION VIDEO', 'FILIPINOS', 'JENNIE', 'LISA', 'LALISA', 'JENLISA', 'JENSOO', 'CHAELISA', 'CHAENNIE', 'CHAESOO', 'LISOO', 'ROSE', 'JISOO', 'YG', 'BIGBANG', 'BTS', 'WALWAL', 'BLACK PINK', 'COMEBACK', 'YG ENTERTAINMENT', 'DIOR', 'CELINE', 'YSL']",Unknown
CaWBSMywkKg,We tried Lechon In the Philippines🇵🇭,UCVQpaRCIn-rB6slVaDDV-6w,Traveling Light,"['travel vlog', 'vlogger', 'travel vlogging', 'how to be a travel vlogger', 'how to become a travel vlogger', 'travel vloggers', 'how to travel vlog', 'how to travel the world without money', 'how to travel cheap', 'how to travel the world', 'how to travel for free', 'how to travel with kids', 'how to travel the world for free', 'how to travel for free with credit cards', 'how to travel the world with almost no money', 'travel', 'travel vlog tips', 'budget travel', 'travel the world', 'travel tips']",US
9fKsaaUZgbs,I'M LEARNING TAGALOG! Foreigner Attempts to learn Filipino #Tagavlog 1,UCVR42zazbJZLL4r2Lo8PqRg,Just Jonny & Chloe,"['learning tagalog', 'learn tagalog', 'foreigner speaking tagalog', 'learn filipino', 'filipino language', 'language learning', 'speaking tagalog', 'tagalog challenge', 'learn to speak tagalog', 'learning tagalog for beginners', 'foreigner learns tagalog', 'Jonny Pease', 'Johnny Pease', 'tagalog language reaction', 'tagalog language lessons for beginners', 'tagalog language speaking', 'foreigner learning tagalog', 'foreigner fluent in tagalog', 'teaching tagalog to foreigners', 'learning tagalog vlog']",GB
FIRyxLCCAyY,MAKING LECHON KAWALI! TRYING DELICIOUS FILIPINO FOOD!,UCVR42zazbJZLL4r2Lo8PqRg,Just Jonny & Chloe,"['filipino food', 'lechon kawali', 'philippines food', 'filipino food mukbang', 'filipino food reaction', 'lechon belly', 'crispy pork belly', 'foreigners in the philippines', 'filipino mukbang', 'reacting to filipino food', 'filipino food taste test', 'fried pork belly', 'filipino food recipes', 'filipino food first time', 'foreigners try lechon kawali', 'filipino food cooking', 'lechon kawali pork belly', 'filipino food review', 'pinoy food', 'pinoy mukbang', 'filipino foreigner', 'filipina foreigner vlog']",GB
FSmtbSYE8pg,Foreign Teacher Lands in Rural America: ‘I Was Surprised’ | VOA Connect,UCVSNOxehfALut52NbkfRBaA,Voice of America,"['Filipina', 'Filiphines', 'teacher', 'rural america', 'foreign teacher', 'teach in America', 'Filipino in America', 'VOA', 'Voice of America']",US
RjTm_613GJY,When foreigners try to learn Filipino dialect,UCVT6Q_ypFDWpgF6kzl9yWzg,unchallenged,"['learning tagalog words', 'sumail', 'tagalog', 'eri neeman dota 2']",PH
JiwWBE21ULs,Interview with Foreigner,UCVUprEYqJlLTMjY7vnMet1A,Aislinn,"['purposive communication', 'gec 005', 'tipqc', 'bsa']",Unknown
TOXYIUkyUP4,SHOUT OUT NI HUBBY || FILIPINA AUSTRALIAN COUPLE IN PHILIPPINES || PINAY FOREIGNER LIFE VLOG,UCVViP4FV3N1WMWH8cTXY6JQ,CHRISSY BUTLER,[],Unknown
BMzt-EsOLzk,"KALANGGAMAN ISLAND, PHILIPPINES 🇵🇭 FOREIGNERS ARE COMING HERE NOW AND THIS IS WHY!",UCVWSmD7gyvZv7fpcgF-oiCQ,Mirco Tere & Bella,"['kalanggaman island', 'philippines', 'kalanggaman island philippines', 'kalanggaman island leyte philippines', 'kalanggaman island palompon leyte philippines', 'philippines vlog', 'philippines travel', 'philippines travel guide', 'leyte', 'leyte tour', 'mirco tere and bella', 'mirco tere and bella latest vlog', 'italian filipina family', 'mirco and tere', 'filippine wife', 'travel guide', 'mirco tere bella', 'foreigner in the philippines', 'life in the philippines', 'simple life in the philippines', 'palompon leyte']",PH
