Video Id,Video Title,Channel Id,Channel Title,Video Tags,Channel Country
U1bUQSMVyDM,"Chicken Inasal, Sarciadong Isda, Menudo And Suman Malagkit 🇵🇭 | Trying Filipino Union New Jersey",UCZ-5uY71p3Xt9YelLWBqRiQ,uncultured,"['trying chicken inasal', 'trying sarciadong isda', 'trying Filipino menudo', 'trying suman malagkit', 'Filipino Food Union New Jersey', 'Filipino Food in Union New Jersey', 'chicken inasal new jersey', 'where to eat Filipino food New Jersey', 'chicken inasal reaction', 'sarciadong isda reaction', 'Filipino menudo reaction', 'filipino menudo', 'suman malagkit New Jersey', 'suman malagkit reaction', 'Trying Filipino Food', 'turo turo New Jersey', 'Trying Filipino Suman', 'Union New Jersey', 'chicken inasal nj']",US
TVed9Vn3wV4,Ginataang Sitaw at Kalabasa & Taho 🇵🇭 | Trying Filipino Food in New York,UCZ-5uY71p3Xt9YelLWBqRiQ,uncultured,"['Ginataang Sitaw at Kalabasa', 'kalabasa sa gata', 'ginataang kalabasa at sitaw', 'Trying Ginataang Sitaw at Kalabasa', 'Ginataang Sitaw at Kalabasa Reaction', 'Trying Taho', 'Taho reaction', 'Filipino Food in New York', 'Trying Filipino Sago', 'silken tofu', 'Filipino Silken Tofu', 'Trying SIlken Tofu', 'Taho', 'Taho Lower Manhattan', 'taho in nyc', 'kalabasa sa gata in NYC', 'Filipino Food', 'Where to eat Filipino Food in New York', 'Trying Filipino Food in New York', 'NY Filipino', 'Trying Filipino sago', 'sago', 'NYC']",US
RyxW65Bj2nk,"Lugaw, Lumpiang Pritto, Pritong Tokwa & Almond Ensaymada 🇵🇭 | Trying Filipino Food in Queens, NYC",UCZ-5uY71p3Xt9YelLWBqRiQ,uncultured,"['Lugaw', 'Trying Lugaw', 'Lugaw Reaction', 'lugao', 'Trying lugao', 'lugao reaction', 'Lumpiang Pritto', 'Trying Lumpiang Pritto', 'Lumpiang Pritto Reaction', 'Almond Ensaymada', 'Ensaymada', 'Trying Ensaymada', 'Ensaymada Reaction', 'Filipino Monsoon', 'Extreme Vlogging', 'lumpiang prito', 'trying lumpiang prito', 'lumpiang prito reaction', 'Little Manila NYC', 'Trying Filipino Rice porridge', 'Filipino Lugaw NYC', 'Lumpiang pritto NYC', 'Best Filipino Food Queens', 'First Time Trying Filipino Foods', 'lugao nyc', 'Pinoy NY']",US
9lrnitRwiwA,"Beef Pares, Dinakdakan & Maxx Menthol Candy 🇵🇭 | Trying Filipino Food Elmhurst Queens",UCZ-5uY71p3Xt9YelLWBqRiQ,uncultured,"['Beef Pares', 'Trying Beef Pares', 'Beef Pares Reaction', 'Dinakdakan', 'Trying Dinakdakan', 'Dinakdakan Reaction', 'Dinakdakan in NYC', 'Beef Pares in NYC', 'Trying Maxx Mint', 'Maxx Mint', 'Trying Pinoy Candy', 'Best Filipino Lunch Elmhurst Queens', 'Turon Turon Queens', 'Filipino Pares', 'pares house Queens', 'pares house', 'Pares house nyc', 'Dinakdakan React', 'Dinakdakan Mukbang', 'Pares Mukbang', 'Best Pinoy Food Elmhurst', 'Pares', 'Pares Reaction', 'Trying Pares', 'maxx candy', 'maxx menthol', 'trying menthol candy']",US
HybCL2ds5uE,🇵🇭🇰🇷🔥Korean Hiphop Junkie react to FLOW G - RAPSTAR (TAG/ENG SUB),UCZ06zxXnKV9gEz3PjDvvgkQ,247 CHILLIN,"['FLOWG', 'FLOWG_reaction', 'FLOWG_reactionvideo', 'FLOWG_reaksyon', 'FLOWG_reaksyonngvideo', 'RAPSTAR', 'RAPSTAR_lyrics', 'RAPSTAR_mv', 'RAPSTAR_musicvideo', 'RAPSTAR_reaction', 'RAPSTAR_reactionvideo', 'RAPSTAR_reaksyon', 'RAPSTAR_reaksyonngvideo', 'FLOWG_RAPSTAR', 'FLOWG_RAPSTAR_lyrics', 'FLOWG_RAPSTAR_mv', 'FLOWG_RAPSTAR_musicvideo', 'FLOWG_RAPSTAR_reaction', 'FLOWG_RAPSTAR_reactionvideo', 'FLOWG_RAPSTAR_reaksyon', 'FLOWG_RAPSTAR_reaksyonngvideo', 'RAPSTAR_FLOWG', 'ExBattalion', 'ExBattalion_FLOWG', '247chillin', '247칠린', '투애니포세븐칠린']",Unknown
uQUKr_aaQhc,LDR MEETING FOR THE FIRST TIME PHILIPPINES AND NETHERLANDS 🇵🇭🇳🇱,UCZ1ICMmb1wvN0KUC5_g2gWQ,TEAMTJ,"['LDR', 'Meeting', 'Holland', 'Philippines', 'TEAMTJ', 'First Meeting', 'Couple']",Unknown
ovbZHr0BYps,Abeeha reacting on funny boys video #abeehafatima #shorts #reactions,UCZ3S5KaxMobISOxG9NNvFpA,Abeeha Fatima,"['funny shorts', 'reaction videos', 'try not to laugh', 'abeeha Fatima', 'viral shorts', 'shorts adopt me', 'reactions', 'Indian reaction videos']",PK
Qek3QOPQqGs,little boy funny reaction video #abeehafatima #shorts #reactionvideo,UCZ3S5KaxMobISOxG9NNvFpA,Abeeha Fatima,"['funny Indian reaction videos', 'Indian funny reaction videos try not to laugh', 'try not to laugh', 'reaction videos']",PK
okbCk7Jk11o,husband wife funny reaction video | try not to laugh #abeehafatima #shorts #reactionvideo,UCZ3S5KaxMobISOxG9NNvFpA,Abeeha Fatima,"['funny shorts', 'abeeha Fatima', 'try not to laugh']",PK
ncjqq1Tusfw,mother and son emotional reaction video #shorts #reactionvideo #abeehafatima,UCZ3S5KaxMobISOxG9NNvFpA,Abeeha Fatima,"['emotional reaction videos', 'emotional videos', 'mother and son emotional videos', 'abeeha Fatima reaction videos']",PK
Tpxp3iSmgDc,How to Pronounce UMAALULONG | Learn Filipino Verbs | Foreigner Speaking Tagalog,UCZ4Levd0faYfS6N6STwl4dg,ENGLISH-TAGALOG DICTIONARY,"['tagalog pronunciation', 'filipino pronunciation', 'filipino pronunciation app', 'how to pronounce in filipino', 'how to pronounce in tagalog', 'in tagalog', 'in filipino', 'learn filipino', 'learn tagalog', 'filipino language tagalog', 'filipino language reaction', 'tagalog language lessons for beginners', 'filipino language lessons for beginners', 'tagalog conversation', 'filipino conversation', 'ofw', 'basic filipino', 'basic tagalog', 'english tagalog dictionary', 'english filipino dictionary', 'speaking tagalog']",PH
ga71ORge-FI,Trying Filipino Snacks & Rating 1-10,UCZC5eoLV900s8ticLdyAGig,No Lost Traditions,"['philippines', 'food', 'trying food', 'trying snacks', 'dried mangoes', 'pork crackers', 'snacks', 'ube', 'sky flakes', 'half filipino', 'half Australian', 'australian tries', 'first time', 'rate', 'rating food', 'rating snacks']",Unknown
2t8QLkPr_r0,REACTION to PHILIPPINES BEST VIRAL VIDEOS Compilation,UCZCMPuY9tJSXrWW12EyO99A,Dan Alexandrov,[],US
yFE0iaG0Y6E,African Girl Trying Balut For The First Time  In Philipines !! Crazy Reaction From Philipinas.,UCZD5OZHEyYG60lF8SBh_JVQ,Dee Mwango,"['Dee Mwango', 'Manila', 'Philipines', 'backpacking', 'world travel', 'solo traveller', 'African girl trying Balut for the first time', 'food', 'street food', 'philipines mostb popular street food', 'Street food in philipines', 'Dee mwango philipines', 'Most popular street food in philipines', 'Tying Balut first time', 'Cebu philipines street food', 'Philipines Popular food', 'Philipines 2022 VLOGS', 'visit philipines', 'Traveling in philipines 2022']",GB
MREoDDmyyX8,Niko griefed the Philippines😭🇵🇭 | Kick & YT : jai5k #jai5k #shorts  #viral #trending #streamer,UCZL99V6xOq70ig4op4kLwqA,Jai5k,[],US
i9jwK96hW3U,Hanggang saan ang Masamang Biro? | One React PH,UCZWDbOnu7B96T4_ERsKcbDA,One React PH,"['barilan sa kanto', 'namatay sa biro dahil sa kare kare', 'philippine news', 'gma news', 'kare kare joke', 'Namatay sa biro', 'joker bad', 'bad joke', 'below the belt jokes', 'barilan sa tindahan', 'Balitnag barila', 'gma 7']",PH
-35HpgZWXbk,ANG MASAMANG EPEKTO NG HOARDING | ONE REACT PH,UCZWDbOnu7B96T4_ERsKcbDA,One React PH,"['makalat', 'hoarding disorder', 'gma news', 'philippine news', 'filipino news', 'podcast', 'gma news live', 'hoarding disorder families', 'hoarding', 'Mental health awareness', 'tambak', 'basura sa bahay', 'kwentuhan', 'sobrang pangogolekta']",PH
h9yvGLRMKXM,how a foreigner husband speaks tagalog and ilokano,UCZXggai8ak8udnhk2Sy90Kw,Kyle Tisoy and Momma,[],BE
2DepVr8lg3Q,Koreans React to Filipino Actress : Maine Mendoza's Dubsmash [ASHanguk],UCZYfd94EsqipAuZyunqVBRQ,ASHanguk 애쉬한국,"['korea', 'Korean', 'ashanguk', 'full movie', 'k pop', 'youtube music videos', 'youtube film', 'south korea', 'watch youtube videos', 'maine mendoza', 'koreans react', 'k drama', 'filipina', 'filipino', 'actress']",KR
BlciQm0YN6s,"🇧🇷 LET'S GO 4 - DJ GBR, IG, Ryan SP, PH, Davi, Luki, Don Juan, Kadu ,GH do 7, GP, TrapLaudo 😳😨🔥",UCZZBpXc8smRSgUanjiR7WXg,DENZEL GO VIRAL ,"['lets go 4', 'gr6 explode', 'mc ig', 'Dj GBR', 'Ryan Sp', 'PH', 'Davi Luki', 'Don Juan', 'Kadu', 'GH', 'GH do 7', 'GP', 'TrapLaudo', 'Tendências Brasil', 'Brasil', 'Músicas Recomendadas', 'Trap Brasil', 'Denzel go viral', 'React', 'Gringos Reagem']",PT
WkPYHd4TMi8,BENEFITS OF SPEAKING TAGALOG[FILIPINO] by FOREIGNER~PHILIPPINES VLOG~,UCZZQ5klfFQ-WzcKqR_jMZBg,Yoshi Japan~pusong pinoy~ ,"['Tagalog', 'Filipino', 'foreigner', 'Japanese', 'philippines', 'vlog', 'benefit', 'speaking', 'mylife', 'study', 'listening']",PH
4QcxOUGlUg0,Foreigners try JOLLIBEE in Manila for the FIRST TIME - Philippines ph,UCZZwilU9bYdS-phW3M7lv6g,Sun Kissed Bucket List,"['jollibee manila', 'jollibee manila philippines', 'manila vlog', 'manila 2022', 'jollibee', 'jollibee mukbang', 'jollibee philippines', 'jollibee first time', 'foreigners try jollibee', 'philippines 2022', 'philippines vlog', 'jollibee chicken', 'jollibee fast food', 'filipino food', 'jollibee asmr', 'jollibee glorietta mall', 'glorietta mall manila', 'glorietta mall', 'philippines food']",GB
i4R5yhUDdHM,FOREIGNER TRYING FILIPINO DISH | GINATAANG BILO - BILO,UCZ_9d4d8x-qnzrDDgLZHyUQ,Dexter's Adventure,"['Foreigner trying filipino food', 'Filipino dish', 'Filipino dishes', 'Bilo bilo', 'Bilo-bilo', 'Ginataang Bilo-bilo']",PH
BpTl3Yod3_E,Two Rock Fans REACT To SB19 Felip Criminal,UCZfYUKBwN396zj6I3DA2k0A,D&J REACT,"['D&J REACT', 'DandJ REACT', 'KPOP', 'PPOP', 'JMETAL', 'sb19', 'vevo', 'sony', 'philippines', 'pop', 'filipino', 'sb19 live', 'sb19 want you', 'sb19 performance', 'sb19 live performance', 'want you', 'want you live', 'pop music', 'pop music videos', 'sb19 boy band', 'boy bands', 'boy bands live', 'get in the zone']",US
ghVDPDJQOo4,Two ROCK Fans REACT to Land of the Best Singers in the World   The Philippines | Female Category,UCZfYUKBwN396zj6I3DA2k0A,D&J REACT,"['D&J REACT', 'DandJ REACT', 'KPOP', 'PPOP', 'JMETAL', 'Two Rock Fans React', 'Reaction Video', 'Music Video Reaction', 'regine velasquez', 'morissette amon', 'katrina velarde', 'Regine Velasquez - Asia’s Songbird', 'Jonalyn Viray - Fearless Diva', 'Charice Pempengco - Int’l Singing Sensation', 'Katrina Velarde - Suklay Diva', 'Rachel Ann Go - International Theater Diva', 'Angeline Quinto - Female Pop Superstar', 'Sheryn Regis - Crystal Voice of Asia', 'Kyla - Asia’s Queen of RnB', 'Jaya - Asia’s Queen of Soul']",US
29tdn7VHGOY,Two Rock Fans REACT To Filipinos Who Made Pinoys Proud #3,UCZfYUKBwN396zj6I3DA2k0A,D&J REACT,"['pinoypride', 'efrenbatareyes', 'philippines', 'Reactions', 'ppop reaction', 'pinoy', 'two rock fans react', 'filipino pride', 'D&J REACT', 'DandJ REACT', 'KPOP', 'PPOP', 'JMETAL', 'filipinos who made us proud', 'pinoy pride', 'filipino foreign reaction', 'sb19', 'leah salonga', 'billy crawford', 'ac bonifacio', 'lucky aces', 'michael jackson', 'miss saigon', 'filipinos are talented', 'filipinos who made pinoys proud #1', 'billy crawford dancing with the stars france', 'danse avec les stars', 'leah salonga story', 'Two Rock Fans REACT', 'D&J']",US
ffK6oaXh3Z8,Two ROCK Fans REACT to Filipinos Who Made Pinoys Proud #1,UCZfYUKBwN396zj6I3DA2k0A,D&J REACT,"['D&J REACT', 'DandJ REACT', 'KPOP', 'PPOP', 'JMETAL', 'filipinos who made us proud', 'pinoy pride', 'filipino foreign reaction', 'sb19', 'leah salonga', 'billy crawford', 'ac bonifacio', 'lucky aces', 'michael jackson', 'miss saigon', 'filipinos are talented', 'filipinos who made pinoys proud #1', 'billy crawford dancing with the stars france', 'danse avec les stars', 'billy crawford danse avec les stars', 'leah salonga story', 'billy crawford story', 'sb19 story', 'ac bonifacio story', 'pinoy', 'pilipinas', 'philippines', 'filipino']",US
hXSxTOWc_Lk,Two Rock Fans REACT To Filipinos Who Made Pinoys Proud #4,UCZfYUKBwN396zj6I3DA2k0A,D&J REACT,"['D&J REACT', 'DandJ REACT', 'KPOP', 'PPOP', 'JMETAL', 'filipinos who made us proud', 'pinoy pride', 'filipino foreign reaction', 'sb19', 'leah salonga', 'billy crawford', 'ac bonifacio', 'lucky aces', 'michael jackson', 'miss saigon', 'filipinos are talented', 'filipinos who made pinoys proud #1', 'billy crawford dancing with the stars france', 'danse avec les stars', 'billy crawford danse avec les stars', 'leah salonga story', 'billy crawford story', 'sb19 story', 'ac bonifacio story', 'pinoy', 'pilipinas', 'philippines', 'filipino']",US
LW3CpWfwozY,"A Date with Miss Fortune Full Movie | Ryan Scott, Jeannette Sousa, Joaquim de Almeida",UCZhZmvqQM_S8vZ7x13wY4cw,Indo Overseas Films,"['Film', 'Movie', 'film 2017', 'movie 2017', 'english film', 'english movie', 'english movie 2017', 'english film 2017', 'kungfu', 'science fiction movies', 'hollywood sci film movies', 'a date with miss fortune full movie']",IN
QCGphCxm3mU,TRYING FILIPINO SNACKS! (First time eating fish crackers),UCZibHcivS_hob0ufgYTMO4w,Patrick Bolton,"['Navy', 'Officer', 'Filipino', 'Snacks', 'Trying', 'First Time', 'Yum', 'Delicious', 'Food', 'Entertainment', 'Mukbang']",US
aGd8k3UwPCg,Top 10 places to see in the Philippines Foreigners React!,UCZj25uUMldry9uOnfhbEvzA,Alex Dauterive,"['philippines', 'pinoy']",US
gaaWf7Jrvag,Foreigner sings FILIPINO song buwan by Juan Karlos|,UCZn-xBIPY6_ewAVxF31JWlQ,superinggo tv,[],Unknown
WjxXqPbTNzM,trying philippines milk tea❤🇵🇭🇰🇷,UCZsFMA6TIRTil3X7kK-xuvA,Greenie_Kits💚💙,[],Unknown
UOtIwzM-4FQ,bts react to sb19 hanggang sa huli {Tagalog and Korean version },UCZwpV_a4oYtZfb-vGWB6LaA,SB19 Unofficial Edit Vedio,[],PH
igS4pqL7bVk,AMERICANS TRYING FILIPINO TREATS!,UCZxEvRscRiPMGTE5xmhiHHg,Kenzie Borowski,"['try', 'treats', 'candy', 'philippine', 'philippino', 'food', 'philippino food', 'trying philippino food', 'philippine candy', 'kenzie', 'taylor', 'kenzie taylor', 'buzzfeed']",US
BbCaySXcPDM,Beautiful Love by Victory Worship (Filipino-Female Version) Live Worship by Victory Fort Music Team,UCZxWAedRNaokJl7OlYgv5jA,Overflow TV #InspireAndShare,"['Beautiful Love', 'Victory', 'Victory Fort', 'Victory Worship', 'Every Nation', 'Papuri', 'Jesus', 'Worship']",PH
wahxQJJnnjA,Beautiful Love by Victory Worship - Filipino Version (Live Worship led by Lee Simon Brown),UCZxWAedRNaokJl7OlYgv5jA,Overflow TV #InspireAndShare,"['Beuatiful Love', 'Victory Worship', 'Lee Simon Brown', 'Victory Fort', 'Jesus', 'Worship', 'Lilim', 'Tribes', 'Every Nation', 'Papuri', 'Pagsamba']",PH
C90YIn03vWY,Philippine Immigration | Berlin Immigration | First time solo traveler | International Flight,UCZzhymXFb4gdRBbeorVA5vA,Marie and Matthias,"['Philippinen', 'Philippines', 'Cebu', 'Cebu City', 'Foreign', 'Marie', 'Matt', 'Marie & Matthias', 'Travel Philippines', 'Istanbul airport', 'Airport', 'Guide', 'long fly', 'layover', 'first travel', 'good airport', 'beautiful', 'largest airport', 'fly', 'travel', 'Germany', 'Turkey', 'Türkei', 'Istanbul', 'first fly', 'first long fly', 'Filipina on travel', 'Flughafen', 'reisen', 'Flug', 'Flugzeug', 'Ankunft', 'Landung', 'Abflug', 'immigration', 'berlin', 'germany', 'deutschland']",PH
S_ggfP2JpfU,WHAT I LOVE ABOUT FILIPINOS | FILIPINO-JAPANESE FAMILY,UC_-_s8YH3NGLjLJ0IGPMkhw,Maaku Jhong,[],JP
18oT_F7pZ4w,FOREIGNERS CANNOT do this in the PHILIPPINES❗️| Nepali Girl REACTS | Rubishaa,UC_054DXO8cKRX8qfhO87n5w,Rubishaa,"['philippines reaction', 'the philippines', 'project nightfall reaction', 'rubisha', 'rubishaa reaction', 'rubishaa', 'reaction', 'philippines', 'philippine election 2022', 'phillipines reaction', 'pinoy', 'pinoy reaction', 'filipino foreign reaction', 'filipino foreign reactor', 'foreign pinoy', 'foreign pinoy reaction', 'project nightfall', 'project nightfall dictator', 'project nightfall dictator reaction', 'project nightfall elections', 'foreigners cannot do this in philippines', 'nepali girl reacts', 'reaction philippines']",US
vMN7Bwoi904,MS. U PH RABIYA MATEO PUMIYOK KAY GLORIA DIAZ! (NAG-REACT SA P2000 BILL KAY MIRIAM DEFENSOR),UC_0mu5KwQT1qVEMogLNSt_Q,Roldan Castro,[],PH
nsCCqw1l4-8,"Real Life Young Filipino celebrity Kilig couples of 2023 ll Kathniel, Lizquen,JakBie,Lionie",UC_2iPQwn_V2SflddzbtalLg,Celinka Updates,"['LoiNie', 'KathNeil', 'JakBie', 'Young Filipino couples']",Unknown
-Ts46vj5sEc,Real Life Fathers of 18 Top Filipino Actors ll You didn't know in 2023,UC_2iPQwn_V2SflddzbtalLg,Celinka Updates,"['Seth Fedelin', 'Kyle Echarri']",Unknown
Qdm15J-PYcI,Real Life Mothers of 22 Top Filipino Actress ll You didn't know in 2023 (Part 1),UC_2iPQwn_V2SflddzbtalLg,Celinka Updates,"['Andrea Brillantes', 'Marian Rivera', 'Belle Mariano', 'Kathryn Bernardo']",Unknown
ZZupQmzaiAo,Foreigner tries FILIPINO BALUT for the FIRST TIME - My thoughts,UC_3W8cBYfZa0RsjjJLmMQhw,Venoshi,"['Philippines', 'Filipino culture', 'Filipino food', 'Filipino cuisine', 'travel', 'foreigner in the Philippines', 'expat life', 'living abroad', 'Balut', 'Balut taste test', 'Balut challenge', 'unique foods', 'exotic foods', 'cultural experiences', 'vlog', 'travel vlog', 'food vlog', 'Filipino vlog', 'Filipino cuisine vlog', 'foodie', 'foodie vlog', 'food travel', 'food travel vlog', 'travel tips', 'Filipino travel', 'Southeast Asia', 'Filipino delicacy']",Unknown
KylHENN9Dyc,Merry Christmas kolkata #kolkata #kolkatamerrychristmas #merrychristmas #merrychristmas2022 #viral,UC_5eQiQCgsj0d0ZdfH1mnOg,Debashish Chaurasia,[],IN
L3z4iABbfWU,THE WORLDPLAY!! | Rapper Reacts to SB19 - 'GENTO' (FIRST REACTION),UC_62jYuKq0O-K66pjrK5jhQ,Knox Hill,"['SB19', 'sb19 reaction', 'sb19 gento', 'gento', 'sb19 lyrics', 'sb19 music', 'sb19 first reaction', 'sb19 gento music video', 'sb19 gento lyrics', 'gento sb19', 'gento sb19 reaction', 'k pop', 'p pop', 'sb19 performance', 'knox hill', 'reaction', 'lyrics', 'rapper', 'full analysis']",US
vJQawhi1UwA,Rapper Reacts to SB19 FOR THE FIRST TIME!! | 'MAPA' OFFICIAL LYRIC VIDEO (First Reaction),UC_62jYuKq0O-K66pjrK5jhQ,Knox Hill,"['sb19', 'sb19 mapa', 'mapa', 'mapa sb19', 'sb19 first reaction', 'sb19 reaction', 'sb19 mapa lyrics', 'sb19 mapa color coded lyrics', 'sb19 music video', 'mapa lyrics', 'mapa reaction', 'sb19 mapa reaction', 'sb19 mapa official lyric video', 'sb19 mapa lyric video', 'sb19 mapa official lyric video reaction']",US
vyQekbrZmjc,Foreigner Job Experience in the Philippines,UC_6sVt9967gh0qVjnM0Ep8A,ZLAT  Val-Van,"['welding in the philippines', 'foreigner welding in philippines', 'foreigner working in the philippines', 'how much can welder earn in the philippines', 'Welding', 'Welding job', 'Construction', 'Construction in philippines', 'Foreigner in philippines', 'Welder salary in philippines', 'Welder salary abroad', 'work experience in the philippines', 'my work experience in filipins']",AU
VpJ0dT0wQE8,SB19- AAA Full Preformance feat. &TEAM  + Acceptance Speech | REACTION #sb19 #mahalima #aaa2023inph,UC_7QbLItoOQ5Ap4QaMJMRVQ,raionhime,[],US
w5PxnOXt59w,I ATE EVERYTHING AT A LAS VEGAS BUFFET (BIGGEST FILIPINO Buffet)| Joel Hansen,UC_9I8ulL_v4SvsXwiVKlzqw,Joel Hansen,"['food challenge', 'eating challenge', 'las vegas buffet', 'filipino food challenge', 'filipino buffet', 'street food challenge', 'seafood buffet', 'best buffet in vegas', 'biggest buffet in vegas', 'sushi buffet', 'all you can eat sushi', 'trying filipino food for the first time', 'Eating Filipino Food', 'jollibee chicken challenge', 'filipino food mukbang', 'buffet challenge', 'crab leg buffet', 'americans try', 'food challenge youtubers', 'biggest food challenge', 'spicy street food challenge', 'jollibee chicken']",CA
-B5RF_pcdko,YAZIK reacts to Morissette Amon - Ang Huling El Bimbo,UC_9tlfrg7umZRU5HHGrBDbQ,Yazik Reacts,"['Morissette', 'Morissette amon', 'Mori', 'ang huling el bimbo', 'Morissette ang huling el bimbo', 'Morissette amon reaction', 'Morissette amon ang huling el bimbo reaction', 'ang huling el bimbo reaction', 'Music', 'Reaction', 'Cover', 'Vocal coach', 'Vocal coach yazik', 'Vocal coach reacts', 'Philippines', 'High notes', 'Low notes', 'Vocal performance', 'Yazik', 'Yazik reacts', 'Yazik vocal coach', 'Yazik singer', 'Yazik artist', 'Singing lessons', 'Vocal lessons', 'Book a lesson', 'www.yaziksinger.com']",PL
lVMH1HOx-vU,PHILIPPINES AIRPORT BASICS - First Time Flyer Guide,UC_Cfg3r1gw54FRuIli0A_mw,G Dumaguing,"['first time flyer guide', 'first time flyers guide airport', 'first time flyers guide philippines', 'domestic flight guide', 'domestic flight philippines', 'domestic flight procedure philippines', 'domestic airport philippines', 'first time flight guide tagalog', 'first time flight guide domestic', 'first time airport', 'cebu mactan airport', 'mactan airport', 'mactan airport terminal 1', 'mactan airport cebu', 'cebu airport', 'g dumaguing', 'FTFG', 'airport basics', 'airport step by step procedure', 'airport steps']",PH
uswAegNX1h8,Foreigner speaks Filipino ❤️,UC_D9KVwCK6-EtohFv2KffWg,analyn lopez,[],Unknown
cAzY3w2UPtA,Trying The STREET FOOD For The FIRST Time In The PHILIPPINES 🇵🇭,UC_DhLSdCwI8YLDKhKeKmGuw,Diana Manadil,"['dianamanadil', 'manadil family', 'Diana manadil', 'ديانا', 'مناديل', 'ديانامناديل', 'عيلة مناديل', 'عيلة المناديل', 'street food', 'street food in the Philippines', 'trying street food', 'food in Philippines', 'Filipino food']",PH
golo19hWgfA,Filipino Fans Are The Most Passionate Fans Ever | TWICE,UC_GvHjYNTKrmoVl-1DsGVow,Pattypatootie,"['TWICE', 'MANILA', 'PH', 'ONCE', 'CONCERT']",PH
mD_ZoHJrYMU,Filipinos are too stunned to speak 😂 #filipino #filipina #youtubeshorts,UC_HQCSxHg6JvKssjr9R1Kcw,Clara Benz,[],CA
0QC13mJHMfk,"Foreigner takes 500$ flight to Manila, Philippines 🇵🇭",UC_JeB7Hk1dea003Ubq3IqTg,Andy Kos,"['@banandyyy', ""@Andy's Vlog"", '#travel', '#explore', 'philippines', 'solotraveltips', 'Manila', 'cebu', 'Andy Kos', 'philippines travel vlog', 'streetfood', 'foreigners in the philippines', 'travel vlog', 'how to travel the philippines', 'filipino food', 'philippines vlog', 'first imression philippines']",DE
OgImQZ_pKA4,"Trying Filipino, Canadian and Australian Snacks",UC_NgfkSU3G32urXrP4oAjJg,Dyosang Jossa,[],Unknown
VEEtA9u7SWM,NONSTOP CHRISTMAS SONGS MEDLEY DISCO TRAXX 2023-2024🔥NEW CHACHA TIKTOK CHRISTMAS DISCO REMIX 2024🔥,UC_O6moMsJdgZcc23EBDUUCQ,Zumba Hits101,"['paskong pinoy medley 2024', 'christmas song 2024', 'paskong pinoy', 'christmas', 'christmas songs', 'paskong pinoy songs', 'tagalog christmas songs', 'non-stop tagalog christmas songs', 'the best pinoy christmas songs', 'best tagalog christmas', 'non-stop christmas medley', 'non-stop christmas songs', 'tagalog christmas', 'christmas songs playlist', 'top christmas songs playlist', 'top christmas songs', 'christmas music', 'paskong pinoy super medley', 'christmas songs medley', 'top christmas', 'christmas song', '2023']",TH
hnC0JT0D_NU,Dilaw - Uhaw (Reaction) LIVE ON WISH 107.5 BUS,UC_OwIfvGco2rDw8kX8NKg8A,Local Band Smokeout,"['local band smokeout reaction', 'music reaction', 'stoner dude reacts', 'LBS', 'music reviews', 'most reaction videos on youtube', 'most reactions', 'review my band', 'reaction mashup', 'reaction band', 'stoner dude', 'moreviews', 'funny', 'first time listening to', 'first time listening too', 'jrock', 'jrock reaction', 'j-rock reaction', 'first time reaction', 'dilaw', 'dilaw reaction', 'dilaw uhaw', 'dilaw uhaw reaction', 'wish 107.5', 'wish 107.5 reaction', 'wish 107.5 live', 'dilaw wish 107.5', 'dilaw uhaw tayong lahat']",US
X66IEn-m5Ho,My Foreigner Bestie Trying Filipino Snacks!,UC_PjvuEQOvaQ1nc87uTQ5kg,Ross Say Production,"['Filipino Snacks', 'Foreigner Tries Filipino Snacks', 'Filipino Food', 'rosssayproductions', 'sayrossproductions', 'filipino', 'foreigner trying filipino foods', 'say ross', 'ross say', 'uk', 'igorot vlogger', 'baguio vlogger', 'igorota vlogs', 'igorots']",FR
KwD4e3ziCb4,Trying FILIPINO FOOD for the FIRST TIME!,UC_YHP03qQytjAfBK6tFcnew,Isaac & Andrea Vlogs,"['isaac and andrea prank', 'isaac and andrea kisses', 'isaac and andrea vlogs', 'couple vlogs', 'isaac and andrea second channel', 'slice and rice', 'filipino food', 'filipino culture', 'filipino', 'dobre brothers', 'filipino food mukbang', 'filipino street food', 'mukbang', 'best filipino food', 'americans try filipino food', 'filipino food review', 'trying filipino food for the first time', 'trying filipino food', 'food reaction video', 'ivanita and lucas', 'kaldereta', 'longaniza', 'laing mukbang', 'lumpia', 'food challenge']",US
Grr_LaehRrk,Trying FILIPINO SNACKS for the FIRST TIME!,UC_YHP03qQytjAfBK6tFcnew,Isaac & Andrea Vlogs,"['isaac and andrea prank', 'isaac and andrea kisses', 'isaac and andrea vlogs', 'couple vlogs', 'isaac and andrea second channel', 'slice and rice', 'filipino food', 'filipino culture', 'filipino', 'dobre brothers', 'filipino food mukbang', 'filipino street food', 'mukbang', 'best filipino food', 'americans try filipino food', 'filipino food review', 'trying filipino food for the first time', 'trying filipino food', 'food reaction video', 'ivanita and lucas', 'kaldereta', 'longaniza', 'laing mukbang', 'lumpia', 'food challenge']",US
UI0Hgxan_LE,"Americans Try Jollibee For The First Time! (Palabok, Aloha Burger, Jolly Spaghetti, Adobo Rice)",UC_YHP03qQytjAfBK6tFcnew,Isaac & Andrea Vlogs,"['isaac and andrea channel', 'isaac and andrea prank', 'isaac and andrea kisses', 'andrea and isaac prank', 'best pranks 2022', 'funny', 'couples', 'couple', 'isaac and andrea vlogs', 'reccomended page', 'andrea and isaac', 'isaac and andrea second channel', 'isaac and andrea shorts', 'couple channel', 'youtube couples', 'Trying JOLLIBEE for the FIRST TIME!', 'we tried jollibee', 'jollibee first time', 'americans try jollibee for the first time', 'food', 'food video', 'trying', 'trying new food', 'trying fillipino food']",US
75kB2mN2c70,May Dumating Kami na Bisita First Time From Philippines Gift Giving For Christmas,UC_auCtqYnAd1pLkP_Y-B7TA,Manila London,"['#manilalondon', '#hosting', 'panlasang pinoy', 'pinoy food', 'UK food', 'pinoy in UK', 'family from Philippines', 'Philippines', 'gammon', 'ham', 'Embotido', 'chicken', 'exchange gift', 'gift giving']",GB
